<?xml version="1.0" encoding="UTF-8"?>
<xsd:schema xmlns:xsd="http://www.w3.org/2001/XMLSchema" elementFormDefault="qualified" attributeFormDefault="unqualified" version="1.5">
  <xsd:complexType name="listOfGlobalParamsType">
    <xsd:sequence>
      <xsd:element name="troposphericDelayCorrection" type="xsd:boolean" default="true"/>
      <xsd:element name="ionosphericDelayCorrection" type="xsd:boolean" default="true"/>
      <xsd:element name="solidEarthTideCorrection" type="xsd:boolean" default="true"/>
    </xsd:sequence>
  </xsd:complexType>
  <xsd:complexType name="generalProcessorConfType">
    <xsd:sequence>
      <xsd:element name="listOfGlobalParams" type="listOfGlobalParamsType"/>
    </xsd:sequence>
  </xsd:complexType>
  <xsd:complexType name="listOfModeParamsType">
    <xsd:sequence>
      <xsd:element name="correctionGridRangeSampling" default="200">
        <xsd:complexType>
          <xsd:simpleContent>
            <xsd:extension base="xsd:short">
              <xsd:attribute name="unit" type="xsd:string" use="required"/>
            </xsd:extension>
          </xsd:simpleContent>
        </xsd:complexType>
      </xsd:element>
      <xsd:element name="correctionGridAzimuthSampling" default="200">
        <xsd:complexType>
          <xsd:simpleContent>
            <xsd:extension base="xsd:short">
              <xsd:attribute name="unit" type="xsd:string" use="required"/>
            </xsd:extension>
          </xsd:simpleContent>
        </xsd:complexType>
      </xsd:element>
      <xsd:element name="bistaticAzimuthCorrection" type="xsd:boolean" default="true"/>
      <xsd:element name="dopplerShiftRangeCorrection" type="xsd:boolean"/>
      <xsd:element name="fmMismatchAzimuthCorrection" type="xsd:boolean"/>
    </xsd:sequence>
  </xsd:complexType>
  <xsd:complexType name="listOfModesType">
    <xsd:sequence>
      <xsd:element name="mode" maxOccurs="unbounded">
        <xsd:complexType>
          <xsd:sequence>
            <xsd:element name="name" type="xsd:string"/>
            <xsd:element name="listOfModeParams" type="listOfModeParamsType"/>
          </xsd:sequence>
        </xsd:complexType>
      </xsd:element>
    </xsd:sequence>
    <xsd:attribute name="count" type="xsd:short" use="required"/>
  </xsd:complexType>
  <xsd:complexType name="modeRelatedConfType">
    <xsd:sequence>
      <xsd:element name="listOfModes" type="listOfModesType"/>
    </xsd:sequence>
  </xsd:complexType>
  <xsd:complexType name="setapConfType">
    <xsd:annotation>
      <xsd:documentation>Root element</xsd:documentation>
    </xsd:annotation>
    <xsd:sequence>
      <xsd:element name="generalProcessorConf" type="generalProcessorConfType"/>
      <xsd:element name="modeRelatedConf" type="modeRelatedConfType"/>
    </xsd:sequence>
    <xsd:attribute name="schemaVersion" type="xsd:decimal" use="required" fixed="1.5"/>
  </xsd:complexType>
  <xsd:element name="setapConf" type="setapConfType">
    <xsd:annotation>
      <xsd:documentation>SETAP configuration auxiliary file definition (AUX_SCF).</xsd:documentation>
    </xsd:annotation>
  </xsd:element>
</xsd:schema>
